{
  "$schema": "https://json-schema.org/draft/2020-12/schema",
  "type": "object",
  "properties": {
    "status": {
      "type": "string",
      "enum": [
        "RESOLVED",
        "PARTIAL",
        "UNRESOLVED",
        "REFUSED_AUTOMATION",
        "AUTHENTICATION_REQUIRED",
        "DISCONNECTED",
        "TECHNICAL_FAILURE"
      ]
    },
    "summary": {
      "anyOf": [
        {
          "type": "object",
          "properties": {
            "value": {
              "type": "string"
            },
            "evidence": {
              "minItems": 1,
              "type": "array",
              "items": {
                "$ref": "#/$defs/__schema0"
              }
            }
          },
          "required": [
            "value",
            "evidence"
          ],
          "additionalProperties": false
        },
        {
          "type": "null"
        }
      ]
    },
    "representativeName": {
      "anyOf": [
        {
          "type": "object",
          "properties": {
            "value": {
              "type": "string"
            },
            "evidence": {
              "minItems": 1,
              "type": "array",
              "items": {
                "$ref": "#/$defs/__schema0"
              }
            }
          },
          "required": [
            "value",
            "evidence"
          ],
          "additionalProperties": false
        },
        {
          "type": "null"
        }
      ]
    },
    "department": {
      "anyOf": [
        {
          "type": "object",
          "properties": {
            "value": {
              "type": "string"
            },
            "evidence": {
              "minItems": 1,
              "type": "array",
              "items": {
                "$ref": "#/$defs/__schema0"
              }
            }
          },
          "required": [
            "value",
            "evidence"
          ],
          "additionalProperties": false
        },
        {
          "type": "null"
        }
      ]
    },
    "caseNumber": {
      "anyOf": [
        {
          "type": "object",
          "properties": {
            "value": {
              "type": "string"
            },
            "evidence": {
              "minItems": 1,
              "type": "array",
              "items": {
                "$ref": "#/$defs/__schema0"
              }
            }
          },
          "required": [
            "value",
            "evidence"
          ],
          "additionalProperties": false
        },
        {
          "type": "null"
        }
      ]
    },
    "resolution": {
      "anyOf": [
        {
          "type": "object",
          "properties": {
            "value": {
              "type": "string"
            },
            "evidence": {
              "minItems": 1,
              "type": "array",
              "items": {
                "$ref": "#/$defs/__schema0"
              }
            }
          },
          "required": [
            "value",
            "evidence"
          ],
          "additionalProperties": false
        },
        {
          "type": "null"
        }
      ]
    },
    "monetaryOutcomes": {
      "type": "array",
      "items": {
        "type": "object",
        "properties": {
          "value": {
            "type": "object",
            "properties": {
              "kind": {
                "type": "string",
                "enum": [
                  "REFUND",
                  "CREDIT",
                  "FEE",
                  "CHARGE",
                  "OTHER"
                ]
              },
              "amountCents": {
                "type": "integer",
                "minimum": -9007199254740991,
                "maximum": 9007199254740991
              }
            },
            "required": [
              "kind",
              "amountCents"
            ],
            "additionalProperties": false
          },
          "evidence": {
            "minItems": 1,
            "type": "array",
            "items": {
              "$ref": "#/$defs/__schema0"
            }
          }
        },
        "required": [
          "value",
          "evidence"
        ],
        "additionalProperties": false
      }
    },
    "companyCommitments": {
      "type": "array",
      "items": {
        "type": "object",
        "properties": {
          "value": {
            "type": "string"
          },
          "evidence": {
            "minItems": 1,
            "type": "array",
            "items": {
              "$ref": "#/$defs/__schema0"
            }
          }
        },
        "required": [
          "value",
          "evidence"
        ],
        "additionalProperties": false
      }
    },
    "userActions": {
      "type": "array",
      "items": {
        "type": "object",
        "properties": {
          "value": {
            "type": "string"
          },
          "evidence": {
            "minItems": 1,
            "type": "array",
            "items": {
              "$ref": "#/$defs/__schema0"
            }
          }
        },
        "required": [
          "value",
          "evidence"
        ],
        "additionalProperties": false
      }
    },
    "deadlines": {
      "type": "array",
      "items": {
        "type": "object",
        "properties": {
          "value": {
            "type": "string"
          },
          "evidence": {
            "minItems": 1,
            "type": "array",
            "items": {
              "$ref": "#/$defs/__schema0"
            }
          }
        },
        "required": [
          "value",
          "evidence"
        ],
        "additionalProperties": false
      }
    },
    "unresolvedItems": {
      "type": "array",
      "items": {
        "type": "object",
        "properties": {
          "value": {
            "type": "string"
          },
          "evidence": {
            "minItems": 1,
            "type": "array",
            "items": {
              "$ref": "#/$defs/__schema0"
            }
          }
        },
        "required": [
          "value",
          "evidence"
        ],
        "additionalProperties": false
      }
    },
    "endedAt": {
      "type": "string"
    },
    "durationSeconds": {
      "type": "integer",
      "minimum": 0,
      "maximum": 9007199254740991
    },
    "estimatedTelephonyCostUsd": {
      "type": "number",
      "minimum": 0
    },
    "llmUsage": {
      "type": "object",
      "properties": {
        "inputTokens": {
          "type": "integer",
          "minimum": 0,
          "maximum": 9007199254740991
        },
        "outputTokens": {
          "type": "integer",
          "minimum": 0,
          "maximum": 9007199254740991
        },
        "totalTokens": {
          "type": "integer",
          "minimum": 0,
          "maximum": 9007199254740991
        }
      },
      "required": [
        "inputTokens",
        "outputTokens",
        "totalTokens"
      ],
      "additionalProperties": false
    }
  },
  "required": [
    "status",
    "summary",
    "representativeName",
    "department",
    "caseNumber",
    "resolution",
    "monetaryOutcomes",
    "companyCommitments",
    "userActions",
    "deadlines",
    "unresolvedItems",
    "endedAt",
    "durationSeconds",
    "estimatedTelephonyCostUsd"
  ],
  "additionalProperties": false,
  "$defs": {
    "__schema0": {
      "type": "object",
      "properties": {
        "turnId": {
          "type": "string"
        },
        "exactQuote": {
          "type": "string",
          "minLength": 1,
          "maxLength": 1000
        }
      },
      "required": [
        "turnId",
        "exactQuote"
      ],
      "additionalProperties": false
    }
  },
  "$id": "https://liaison-protocol.invalid/v1/outcome-report.schema.json",
  "title": "OutcomeReport"
}
